hotel_unit,name,rating,date,review,processed_review,translated_review
Go,Muhammad I. P.,6.4,2018-04-23,"Kelengkapan fasilitas baik kamar dan kamar mandi tidak lengkap, seperti tisu dan lain-lain, hotel baru memaksakan beroperasi, WiFi sangat lemot, Untuk sarapan hanya 1 menu, buah hanya 1 menu dan untuk minum saja 1 menu, bintang 3 serasa hotel melati",lengkap fasilitas baik kamar kamar mandi lengkap tisu lainlain hotel baru paksa operasi wifi sangat lambat sarap menu buah menu minum menu bintang serasa hotel melati,"complete facilities, good bathroom, complete with tissue, other new hotels, forced wifi operation is very slow, the fruit menu, drinking menu, star menu, feels like a jasmine hotel"
Go,TK,8.5,2017-11-14,"Lingkungan nyaman, tempat bersih, akses mudah dijangkau.",lingkung nyaman tempat bersih akses mudah jangkau,"comfortable environment, clean place, easy access"
Go,YY,10.0,2018-04-20,"Pelayanan memuaskan, jadikan tujuan perjalanan di Yogyakarta menjadi sangat berkesan",layan muas jadi tuju jalan yogyakarta jadi sangat kesan,the service is satisfied so going to Jalan Yogyakarta is very impressive
Go,DH,9.1,2018-02-03,Kamar bersih dan cukup luas. Sayang sarapannya sangat biasa,kamar bersih cukup luas sayang sarap sangat biasa,"the rooms are clean, quite spacious, unfortunately the breakfast is very ordinary"
Go,D***i,6.7,2024-06-18,"Kalo hujan air merembes di dinding dekat gorden, ac keluar air netes ke bawah, suara dari luar kedengaran berisik.",kalau hujan air rembes dinding dekat gorden ac keluar air netes bawah suara luar dengar berisik,"If it rains, water seeps through the walls near the AC curtains, water drips down the outside and sounds noisy"
Go,DA,6.7,2021-10-30,"Hotelnya bagus tapi untuk kamar kurang bersih, seprai banyak bercak noda dan kotor. Awal masuk kamar juga sandal hotelnya tidak tertata dan cuma satu aja.",hotel bagus kamar kurang bersih seprai banyak bercak noda kotor awal masuk kamar sandal hotel tata cuma satu,"good hotel, rooms are not clean, sheets have lots of dirty stains when you enter the room, only one set of hotel slippers"
Go,AMALIA K.,9.7,2017-05-10,Tingkatkan pada makanannya...Kurang lengkap,tingkat makanannyakurang lengkap,the level of food is incomplete
Go,BS,9.7,2017-09-30,Hotel bersih dan nyaman dekat bandara,hotel bersih nyaman dekat bandara,clean comfortable hotel near the airport
Go,CS,9.7,2018-01-12,"Kamarnya luas, dekat airport, bersih, pokoknya puas.",kamar luas dekat airport bersih pokok puas,"spacious rooms near the airport, clean, just satisfied"
Go,GM,9.1,2018-07-02,"Overall okelah, tapi kamar tidak kedap suara sehingga terdengar sampai dalam kamar.",overall oke kamar kedap suara dengar kamar,overall okay soundproof room hear the room
Go,PA,6.1,2022-12-31,"Kebersihannya kurang, di kamar mandi banyak nat lumutan, kolong kasur tidak disapu dengan baik, ada bekas permen lengket yang meleleh, bungkus makanan dari pengunjung sebelumnya tidak dibuang.",bersih kurang kamar mandi banyak nat lumut kolong kasur sapu baik bekas permen lengket leleh bungkus makan unjung belum buang,"The bathroom is not clean enough, there is a lot of moss grout under the mattress, a good broom used for melted sticky candy and food wrappers that haven't been thrown away yet"
Go,Ya,10.0,2023-12-26,"Bagus, murah, pelayanan ramah, studio suite kurang kulkas.",bagus murah layan ramah studio suite kurang kulkas,good cheap friendly service studio suite lacking refrigerator
Go,G***t,6.5,2024-10-31,"Staf ramah, valey mobil lambat sekali. Kebersihan kamar, tempat tidur, kamar mandi harus lebih diperhatikan. Tempat tidur saya banyak kutunya dan tempat air minum ada kecoa. Sudah difoto oleh staf.",staf ramah valey mobil lambat sekali bersih kamar tempat tidur kamar mandi lebih perhati tempat tidur banyak kutu tempat air minum kecoa foto staf,friendly staff valey car very slow clean room bed bathroom more attentive bed lots of fleas drinking water place cockroaches photo of staff
Go,IN,8.5,2019-01-07,,,
Go,SS,8.8,2017-09-25,"Sangat nyaman,bersih,pelayanan bagus",sangat nyamanbersihpelayanan bagus,very comfortable clean good service
Go,V,9.7,2019-02-19,Bagus banget tempatnya bersih pelayannya ramah semua khas orang jawa yang sopan santunnya luar biasa mantap.,bagus banget tempat bersih layan ramah semua khas orang jawa sopan santun luar biasa mantap,"Very nice, clean place, friendly service, all typical Javanese people, extraordinary manners"
Go,D***n,9.7,2024-05-19,"Kamar mandi bersih, nyaman, staf helpfully dan ramah.",kamar mandi bersih nyaman staf helpfully ramah,"clean comfortable bathroom, friendly helpful staff"
Go,DS,6.2,2022-06-14,"Kamar kotor sekali banyak debu, linen bed kotor kaya tidak di ganti, handuk kotor dan rawing, koridor kotor sekali dan 1 lagi tidak ada kamar smoking.",kamar kotor sekali banyak debu linen bed kotor kaya ganti handuk kotor rawing koridor kotor sekali kamar smoking,"the room is very dirty, lots of dust, the bed linen is dirty, like changing dirty towels, the corridor is very dirty, the smoking room"
Go,RW,8.5,2017-08-14,ya oke lahh buat hotel yang strategis dengan biaya ringan,iya oke lahh buat hotel strategis biaya ringan,"Yes, it's okay for a strategic hotel with low costs"
Go,MA,8.5,2019-07-06,Itu adalah hotel yang bagus untuk menginap dengan harga yang terjangkau.,hotel bagus inap harga jangkau,good hotel to stay at affordable price
Go,vita a.,6.0,2019-10-28,"Menu sarapan yang standar banget, untuk harga hotel segitu serta kamar AC mati, sehingga malam hari ada tukang yang membetulkan AC terlebih dahulu. Yang lain sudah oke, cuma menu sarapan yang seperti hotel bintang 2.",menu sarap standar banget harga hotel segitu kamar ac mati malam hari tukang betul ac lebih oke cuma menu sarap hotel bintang,"the breakfast menu is really standard, the hotel price is that much, the AC room dies at night, the repairman fixes the AC, it's better, only the breakfast menu of a star hotel"
Go,DM,8.5,2017-09-25,"Bagus, nice place, cuma karena mungkin bangunan baru sehingga lantai masih kotor..",bagus bagus place cuma mungkin bangun baru lantai kotor,"nice, nice place, maybe just build a new dirty floor"
Go,s,8.2,2017-05-29,"Kamar bersih, murah, hanya makanannya yang mengecewakan..semoga kedepanya bisa lebih baik.",kamar bersih murah makan mengecewakansemoga depa lebih baik,"cheap clean rooms, disappointing food, hopefully it will be better"
Go,HN,9.3,2018-06-24,"Kamarnya luas, bersih, dekat jalan protokol",kamar luas bersih dekat jalan protokol,clean spacious rooms near the main road
Go,mh,9.1,2018-04-04,"bersih, nyaman, tenang dan harga sesuai yg di dapat",bersih nyaman tenang harga sesuai,clean comfortable quiet price appropriate
Go,Y***s,6.3,2024-03-19,Kebersihan kamar mandi perlu ditingkatkan. Ada beberapa kecoak. Lantai kamar mandi sangat licin.,bersih kamar mandi perlu tingkat beberapa kecoak lantai kamar mandi sangat licin,clean bathroom needs to level some cockroaches bathroom floor is very slippery
Go,PD,9.7,2022-02-28,,,
Go,AF,6.0,2023-02-09,"Dispenser sabun tidak berfungsi, mereka memberikan botol sabun sebagai penggantinya. Tidak ada yang membantu kami menurunkan barang bawaan kami dari bagasi. Bantalnya mengerikan. Sangat kurus. Bahkan hotel bintang 2 memiliki bantal yang lebih baik. Air panasnya bukan air panas. Air hangatnya.",dispenser sabun fungsi beri botol sabun ganti bantu turun barang bawa bagasi bantal keri sangat kurus bahkan hotel bintang milik bantal lebih baik air panas bukan air panas air hangat,soap dispenser function give soap bottle change help unload luggage keri pillow is very thin even star hotels own pillows are better hot water not hot water warm water
Go,td,5.6,2022-02-01,,,
Go,lz,5.9,2023-07-03,"Closet kotor noda berkerak, lantai dan dinding kamar mandi banyak noda kuning. Lantai kamar kotor. Sprei warnanya putih butek dan kasur tidak kokoh.",closet kotor noda kerak lantai dinding kamar mandi banyak noda kuning lantai kamar kotor sprei warna putih butek kasur kokoh,"Dirty closet, crusty stains, bathroom wall floor, lots of yellow stains, dirty bedroom floor, dirty white bed sheets, sturdy mattress"
Go,Toni N.,8.8,2019-02-17,"Lahan parkir luas, dekat dengan bandara Adi Sujcipto",lahan parkir luas dekat bandara adi sujcipto,Large parking area near Adisutjipto airport
Go,D***n,10.0,2024-06-04,"Harga sangat sesuai, tempat nyaman.",harga sangat sesuai tempat nyaman,the price is very appropriate for the comfortable place
Go,RK,10.0,2017-07-06,Nyaman dan sesuai dengan penawaran.,nyaman sesuai tawar,comfortable according to bargain
Go,Rosyid I. W.,9.4,2018-09-10,"Sebanding kok sama harganya. Kalau ada 1 hal yang saya komplain adalah handuknya, sudah usang. Mohon hal-hal kecil tapi esensial gini lebih diperhatikan.",banding kok sama harga kalau komplain handuk usang mohon halhal kecil esensial begini lebih perhati,"If you complain about worn out towels, please pay more attention to small, essential things like this"
Go,RH,8.8,2018-04-08,Simple dan nyaman...perlengkapan kamar mandi ditingkatkan.,simple nyamanperlengkapan kamar mandi tingkat,simple comfortable level bathroom equipment
Go,DM,8.5,2019-08-26,"Pelayanan kurang bagus, alat makan tidak ada, sarapannya juga makanan yang dipanasi tidak menggugah selera makan.",layan kurang bagus alat makan sarap makan panas gugah selera makan,"The service is not good, the cutlery is hot, the food is hot, it arouses your appetite"
Go,YR,6.1,2017-10-15,"Kamar luas, sayang pelayanan kurang memuaskan,lagi hujan deres, parkirnya tidak ada satpam (info dari resepsionis pada lagi makan padahal ada 2 satpam, kenapa tidak gantian makannya ya?) bantalnya kaya bantal yang d jual keliling,kayanya bagusan bantal yang di jual bapak keliling",kamar luas sayang layan kurang memuaskanlagi hujan deres parkir satu aman informasi resepsionis makan padahal satu aman ganti makan iya bantal kaya bantal jual kelilingkayanya bagus bantal jual bapak keliling,"Spacious rooms, unfortunately the service is less than satisfactory, it's pouring rain, one safe parking, information from the receptionist for eating, even though one is safe, changing food. Yes, the pillows are rich, the pillows are sold around, they are good, the pillows are sold by the traveling father."
Go,IY,6.2,2018-12-02,"Saya di kamar yang ada pintunya ke kamar sebelah, ada pintu sebagai sekat. itu buat saya tidak nyaman, kedua akustiknya parah jelek sekali, Sebelah cuma ngobrol kedengaran berisik sampai kamar saya. Selain itu getaran-tetaran dan dorongan kursi dari kamar lain terasa sekali berisik dan mengganggu, kasur banyak bercak. Disediakan kopi tapi tidak ada sendok atau pengaduk. siaran TV sangat tidak jernih.",kamar pintu kamar belah pintu sekat buat nyaman dua akustik parah jelek sekali belah cuma ngobrol dengar berisik kamar getarantetaran dorong kursi kamar asa sekali berisik ganggu kasur banyak bercak sedia kopi sendok aduk siar tv sangat jernih,"the room has a split door, a divider makes it comfortable, the acoustics are very bad, split only when you chat, you can hear the noise, the room vibrates, the room pushes the chair, the room feels very noisy, the mattress has lots of spots, coffee is ready, a spoon is stirred, the TV broadcast is very clear"
Go,D,5.6,2020-10-12,"Sebenarnya hotelnya bagus, kamarnya pun cukup luas, detail interiornya juga dapat. Cuma masukan saja untuk karyawannya terutama untuk (fo dan security) kalian garda depan ketika orang c/i. tolong hospitalitynya dijaga. Terutama untuk pegawai cewe yang pake seragam unguk, Saya tahu anda disitu senior (diantara anak-anak training dan yang pakai batik) dan seharusnya sikap anda tidak seperti itu dengan tamu anda, Sop hospitalitynya sama sekali tidak ada. dari awal check-ih sudah mengecewakan. Seumur-seumur baru kali ini saya dibuat kecewa saat c/i. Memansan jadinya hotel bagus kalau attitude karyawannya seperti itu.",benar hotel bagus kamar cukup luas detail interior cuma masuk karyawannya utama fo security kalian garda depan orang ci hospitalitynya jaga utama pegawai cewek pakai seragam unguk tahu situ senior antara anakanak training pakai batik sikap tamu sop hospitalitynya sama sekali awal checkih kecewa seumurseumur baru kali buat kecewa ci memansan jadi hotel bagus kalau attitude karyawannya,"it's true that the hotel is good, the rooms are quite spacious, the interior details are just in, the employees are the main thing, fo security, you are the front guard, the hospitality people are the main ones, the female employees wear uniforms, you know, there are seniors among the training children, they wear batik, the attitude of the guests, sop the hospitality, at all, at the beginning of the check, I was disappointed for the rest of my life, the first time I was disappointed, Ci. Memansan is a good hotel if the attitude of its employees"
Go,M,6.0,2019-06-25,Kamarnya kurang nyaman karena suara obrolan dari kamar sebelahnya terdengar jelas dan sangat mengganggu istirahat saya.,kamar kurang nyaman suara obrol kamar belah dengar jelas sangat ganggu istirahat,"The room is not comfortable, the sound of chatter in the room between the ears is clearly very disturbing to rest"
Go,ND,6.4,2022-01-07,Fasilitas kurang lengkap tidak sesuai.,fasilitas kurang lengkap sesuai,the facilities are not complete enough
Go,T***a,6.5,2024-08-14,"Kamar bagus dan luas untuk harga segitu, lokasi agak susah dicapai (kalau mengikuti gmaps) dan parkiran susah+jauh dari lobby. Yang paling menyedihkan adalah dress untuk prewedding saya rusak karena kelalaian karyawan hotel. Awalnya pagi-pagi kami mau pinjam setrika namun ternyata tidak bisa, dan jika ingin disetrikakan harus menunggu jam 7.30. Kmd ada karyawan yang menawarkan untuk menyetrikakan dengan fee 30k/baju, setelah disetrika tnyt baju masih sangat kusut dengan alasan yang menyetrikakan adl anak magang housekeeping. Akhirnya karyawan tersebut menawarkan disetrikakan di laundry terdekat. Tnyt waktu perjalanan, dress saya tersangkut rantai motor sehingga terkoyak dan kotor 😅 ya namanya kecelakaan sih ya, karyawan tersebut meminta maaf dan ingin mencarikan pengganti dress (jelas tidak sempat karena itu hari H) serta menawarkan untuk menanggung biaya setrikanya. Kami menolak, dan kami memutuskan untuk membayar biaya setrikanya karena memang sudah sepakat untuk minta disetrikakan. Waktu bayar ke pihak resepsionis, ternyata biayanya hanya 5k/baju. 🫠 ya mungkin biaya 30k tadi adalah biaya jasa kebaik hatian mungkin yaa. Yang dipermasalahkan di sini adalah kejujuran dan tanggung jawab. Jika tidak sanggup maka jangan menyanggupi dari awal. Saya harap karyawan tersebut tidak dipecat, cukup diberikan peringatan. Terima kasih.",kamar bagus luas harga segitu lokasi susah capai kalau ikut gmaps parkir susahjauh lobby paling sedih dress prewedding rusak lalai karyawan hotel awal pagipagi mau pinjam setrika nyata setrika tunggu jam kmd karyawan tawar setrika fee kbaju setrika tnyt baju sangat kusut alas setrika adl anak magang housekeeping akhir karyawan sebut tawar setrika laundry dekat tnyt waktu jalan dress sangkut rantai motor koyak kotor iya nama celaka sih iya karyawan sebut minta maaf cari ganti dress jelas sempat hari h tawar tanggung biaya setrika tolak putus bayar biaya setrika memang sepakat minta setrika waktu bayar pihak resepsionis nyata biaya kbaju  iya mungkin biaya tadi biaya jasa baik hati mungkin yaa masalah sini jujur tanggung jawab sanggup jangan sanggup awal harap karyawan sebut pecat cukup beri ingat terima kasih,"nice spacious rooms, that price, the location is hard to reach if you follow gmaps, parking is difficult, far from the saddest lobby, the pre-wedding dress was damaged, the hotel employee was negligent, early in the morning, wanted to borrow a real iron, the iron was waiting for hours, then the employee bargained for the ironing fee, but the clothes were ironed, the clothes were very wrinkled, the ironing board was a housekeeping intern at the end of the employee call me bargaining laundry iron near tnyt while walking, dress gets caught in motorbike chain torn dirty yes it's a bad name yes employee says sorry looking for a change of dress obviously has time to haggle for ironing costs refuse to pay the ironing fee, indeed agree to ask for an iron when the receptionist pays for the actual cost of clothes, yes, maybe that fee is a service fee, be kind, maybe yes, the problem here is to be honest, take responsibility, don't be able to do it early, please call the employee fired, just give a reminder, thank you"
Go,KA,5.9,2018-11-05,"Sprei ada noda, terus waktu check-out ada charge karena penggunaan telpon, padahal tidak memakai telpon sama sekali.",sprei noda terus waktu checkout charge guna telpon padahal pakai telpon sama sekali,The bed sheets kept getting stained at checkout and charged for telephone even though I used the telephone at all
Go,AY,8.8,2024-07-11,"Overall hotel bagus, kamar luas, hanya makanan waktu breakfast bisa di tambah variasi. Terima kasih.",overall hotel bagus kamar luas makan waktu breakfast tambah variasi terima kasih,"Overall a good hotel, spacious rooms, added variety at breakfast, thank you"
Go,Th,8.5,2017-12-22,Menu sarapannya mengecewakan selama 4 malam menginap menunya tidak bervariasi.,menu sarap kecewa lama malam inap menu variasi,"breakfast menu, disappointed with long night's stay, varied menu"
Go,RA,9.7,2018-04-17,Semuanya bagus kamar akses dan sebagainya,semua bagus kamar akses bagai,all good access rooms like
Go,SC,6.0,2023-04-15,"Saya menghabiskan 1 malam di hotel ini. Hotel ini memiliki kamar yang besar dan luas tetapi tidak terlalu higienis, ada beberapa bayi kecoak di kamar kami dan di kamar mandi kami, sangat buruk: (.",habis malam hotel hotel milik kamar besar luas terlalu higienis beberapa bayi kecoak kamar kamar mandi sangat buruk,finished the night the hotel belonged to the large spacious room too hygienic some baby cockroaches the room the bathroom was very bad
Go,BP,5.5,2020-03-01,"Kamar sangat kotor, untuk hotel sekelas ini. Mohon lebih memperhatikan kebersihan kamar. Dan gelas di kamar kotor dan cuma dapet satu. Teko penuh debu sehingga harus di cuci sendiri. Mohon di perhatikan kedepannya",kamar sangat kotor hotel kelas mohon lebih perhati bersih kamar gelas kamar kotor cuma satu teko penuh debu cuci sendiri mohon perhati depan,"the room is very dirty, class hotel, please be more careful, clean the room, the glass is dirty, only one kettle is full of dust, wash it yourself, please pay attention to the front"
Go,EN,5.8,2017-11-27,"Sarapannya begitu habis tidak ditambahi lagi, piring-piring kotor dari orang yang sudah selesai sarapan tidak segera dibersihkan. Sampah di lorong tidak segera di bersih kan.",sarap habis tambah piringpiring kotor orang selesai sarap segera bersih sampah lorong segera bersih kan,"after breakfast, add dirty dishes, people finish breakfast, immediately clean the trash, the hallway will be cleaned immediately, right?"
Go,AA,8.5,2019-06-06,"Dekat dengan bandara, kamar bersih.",dekat bandara kamar bersih,near the airport clean rooms
Go,AD,8.7,2018-07-23,"Kamar nyaman tempat tidur oke, kebersihan dan standar kebersihan ditingkatkan sarung bantal lupa dipasang, makanan cukup sesuai harga.",kamar nyaman tempat tidur oke bersih standar bersih tingkat sarung bantal lupa pasang makan cukup sesuai harga,"the room is comfortable, the bed is okay, clean, standard, clean, the level of the pillowcase, forget to put it on, the food is adequate according to the price"
Go,RD,9.7,2022-08-05,"Nyaman, bersih, ditinggal siang pas balik udah rapi semuanyaa 👍, pelayanannya juga ramah, semuanya berjalan dengan baik 👍.",nyaman bersih tinggal siang pas balik rapi semuanyaa layan ramah semua jalan baik,"comfortable, clean, stay in the afternoon when you come back, everything is neat, the service is friendly, everything is good"
Go,A,8.8,2018-06-24,"Kamarnya luas, bersih dan dingin cuma tidak terlalu kedap suara, suara yang dari luar kedengaran kencang. Overall great hotel.",kamar luas bersih dingin cuma terlalu kedap suara suara luar dengar kencang overall great hotel,"the rooms are spacious, clean, cold, just too soundproof, outside sounds can be heard loudly, overall great hotel"
Go,Galih a. h. p.,5.6,2019-07-15,"Sprei kasur dan bantal banyak noda tidak putih bersih, bantal tipis, variasi breakfast biasa saja (terkadang itu-itu saja).",sprei kasur bantal banyak noda putih bersih bantal tipis variasi breakfast biasa terkadang ituitu,"Bed sheets, pillows, lots of clean white stains, thin pillows, sometimes the usual breakfast variations are the same"
Go,AA,4.5,2023-05-30,"Handuk belum tersedia, layanan gak 24jam, gak ramah sama sekali. Kecewa.",handuk sedia layan jam ramah sama sekali kecewa,towels available for friendly service at all disappointed
Go,YA,9.4,2017-10-23,"Nyaman & menyenangkan, jadi kalau pas ke jogja kami selalu menginap di Grand Orchid Hotel",nyaman senang jadi kalau pas jogja selalu inap grand orchid hotel,"comfortable, happy, so if you're in Jogja, you always stay at the Grand Orchid Hotel"
Go,Kurniadi W.,8.5,2018-03-04,Memuaskan. Tapi sayang saya tidak sempat coba makanannya,muas sayang sempat coba makan,"I'm satisfied, darling, I've had time to try eating"
Go,Hm,6.0,2019-01-05,"AC tidak dingin bahkan seperti tidak hidup, access card ke lift kadang tidak bisa, sangat berisik dimalam hari.",ac dingin bahkan hidup access card lift kadang sangat berisik malam hari,"the AC is cold and even the access card lift is on, sometimes it's very noisy at night"
Go,LR,6.3,2018-11-03,"Pada saat breakfast agak ricuh, karena bareng dengan group sekolah.",breakfast ricuh bareng group sekolah,chaotic breakfast with the school group
Go,Sonia R. N.,9.7,2019-02-20,"Hotelnya nyaman bersih, petugas resepsionisnya ramah banget, hotelnya dekat sama bandara, dekat tempat oleh-oleh juga. Jadi tidak mengabiskan banyak waktu buat kesana kemari nyari oleh-oleh.",hotel nyaman bersih tugas resepsionis ramah banget hotel dekat sama bandara dekat tempat oleholeh jadi abis banyak waktu buat kesana kemari cari oleholeh,"the hotel is comfortable, clean, the receptionist is very friendly, the hotel is close to the airport, near the souvenir place, so there is a lot of time to go here and there looking for souvenirs"
Go,CD,8.5,2017-11-30,Itu Bagus. Kami memiliki kamar yang nyaman dan bersih.,bagus milik kamar nyaman bersih,nice clean comfortable rooms
Go,D***i,6.6,2024-08-17,"Kamar dan fasilitas kurang diperhatikan kebersihan nya, saya sering menemukan hewan kecil seperti kec*a di kamar dan di tempat makan.",kamar fasilitas kurang perhati bersih nya sering temu hewan kecil keca kamar tempat makan,"Room facilities don't pay attention to cleanliness, small animals often come across in the room where they eat"
Go,a,9.4,2023-10-31,"Kamar luas, amenitis lengkap, lokasi agak jauh ke pusat kota, semisal Malioboro atau Keraton, bagi traveler yang ga bawa kendaraan disarankan untuk cari rental kedaraan yang banyak tersebar di kota ini. Untuk breakfast ga banyak pilihan untuk kelas bintang 3. Tapi masih bisa direkomendasikan untuk para traveler yang mengunjungi Jogja. Terima kasih buat Grand Orchid Yogyakarta dan aplikasi. Semoga sukses selalu.",kamar luas amenitis lengkap lokasi jauh pusat kota misal malioboro keraton traveler bawa kendara saran cari rental dara banyak sebar kota breakfast banyak pilih kelas bintang rekomendasi traveler unjung jogja terima kasih buat grand orchid yogyakarta aplikasi moga sukses selalu,"spacious rooms, complete amenities, location far from the city center, for example, Malioboro Palace, traveler, bring a vehicle, suggestions for finding a rental, lots of city spreads, breakfast, lots of choices, star class, traveler recommendations, visit Jogja, thank you for the Grand Orchid Yogyakarta application, good luck always"
Go,YT,6.9,2017-11-21,Hotel nya bagus Namun pelayanan nya masih kurang baik,hotel nya bagus layan nya kurang baik,The hotel is good but the service is not good
Go,SH,9.7,2017-10-06,"Bagus, bersih, akses kemana mana mudah, dekat bandara",bagus bersih akses mana mudah dekat bandara,"nice clean, easy access near the airport"
Go,WN,10.0,2017-05-24,Senang tinggal di dekat bandara.,senang tinggal dekat bandara,nice to live near the airport
Go,Pratiwi S. W.,9.1,2023-01-08,"Senang bisa menginap di sini. Semoga nanti kalau ke Jogja lagi, mau nginep di sini",senang inap sini moga kalau jogja mau inap sini,"happy to stay here, hopefully if you are in Jogja you will want to stay here"
Go,FI,8.8,2017-09-30,Makanannya enak dan lokasinya deket bandara..,makan enak lokasi dekat bandara,"good food, location near the airport"
Go,CT,9.7,2017-06-06,Sangat baik Bersih. Kenyamanan dan indah,sangat baik bersih nyaman indah,very good clean comfortable beautiful
Go,AM,8.5,2019-01-15,"Mantap, sesuai dengan yang ada di foto, pelayanan ramah, bersih, mantap.",mantap sesuai foto layan ramah bersih mantap,"great, according to the photo, friendly, clean, great service"
Go,Helmi S.,8.5,2023-02-13,"Kamar persis seperti di foto dan dekat dengan tempat kuliner, sangat cocok untuk liburan keluarga, tetapi parkirannya di luar gedung.",kamar persis foto dekat tempat kuliner sangat cocok libur keluarga parkir luar gedung,"the room is exactly the photo near the culinary place, very suitable for family holidays, parking outside the building"
