hotel_unit,name,rating,date,review,processed_review,translated_review
Go,dw,8.5,2023-12-10,"Hotel cukup bersih, kamar nyaman, air panas mengalir lancar, hanya area parkir cukup terbatas, petugas receptionist agar lebih ramah.",hotel cukup bersih kamar nyaman air panas alir lancar area parkir cukup batas tugas receptionist lebih ramah,"The hotel is quite clean, the rooms are comfortable, the hot water flows smoothly, the parking area is quite limited, the receptionist's duties are friendlier"
Go,I***a,9.4,2024-07-08,Pelayanan ramah dan jam check in check out sesuai.,layan ramah jam check in check out sesuai,"Friendly service, check in and out hours are appropriate"
Go,WW,8.5,2019-02-21,,,
Go,BS,10.0,2018-04-30,,,
Go,YK,5.8,2017-05-22,"Kami cek in jam 14.30. Baru dapat kunci dan bisa masuk kamar pukul 16.10. Itupun karena saya sudah agak marah dan meminta untuk cepat. Jadi kami menunggu cek in hampir 2 jam. Parkir juga diluar, dipinggir jalan tanpa adanya pengawasan. Mohon untuk ditingkatkan pelayanannya",cek in jam baru kunci masuk kamar pukul itu marah minta cepat jadi tunggu cek in hampir jam parkir luar pinggir jalan ada awas mohon tingkat layan,check in new time the key to enter the room hit it angry asked to hurry up so wait check in almost at the parking lot outside the roadside there is a warning please level of service
Go,OS,8.5,2021-04-24,Good view good service and good at everything with cheap price,bagus view bagus service bagus at everything with cheap price,"good view, good service at everything with cheap price"
Go,desi s.,6.0,2019-07-31,Kurang puas.,kurang puas,less satisfied
Go,DP,5.2,2019-08-27,Saya pesan kamar di hotel ini untuk 2 malam. Keadaan kamar saat masuk kotor. Dari mulai sprei bantal. Saat saya pesan untuk pinjam hair dryer dan setrika pun tidak ada sama sekali dalam dua hari berturut-turut dengan berbagai alasan dari staf. Saya sangat kecewa saat menginap di sini.,pesan kamar hotel malam ada kamar masuk kotor mulai sprei bantal pesan pinjam hair dryer setrika sama sekali hari berturutturut bagai alas staf sangat kecewa inap sini,"ordered a hotel room at night there was a dirty entry room starting from bed sheets, pillows, ordered to borrow a hair dryer, an iron at all, the day in a row was like a base, the staff was very disappointed to stay here"
Go,MR,10.0,2024-07-22,"Menginap di sini karena untuk tempat istirahat pasca nonton konser prambanan jazz festival, hotelnya nyaman dan strategis. Kebetulan satu hotel dengan salah satu pengisi acara di PJF.",inap sini tempat istirahat pasca nonton konser prambanan jazz festival hotel nyaman strategis betul satu hotel salah satu isi acara pjf,"Stay here, a place to rest after watching the Prambanan Jazz Festival concert, a comfortable strategic hotel, really a hotel, one of the contents of the PJF event"
Go,as,6.1,2018-04-18,Lantai terasa berdebu tetapi lokasi ok lah,lantai asa debu lokasi lah,The floor has dust on the location
Go,Nofriagara D. H.,6.1,2018-03-18,"Tidak ada fasilitas hairdryer di tiap kamar, menu makanan room service nya tidak lengkap, tempat tidur gatal",fasilitas hairdryer tiap kamar menu makan room service nya lengkap tempat tidur gatal,"Hairdryer facilities in each room, room service dining menu, complete with scratchy beds"
Go,rh,8.4,2017-11-09,"Overall bagus ya, hotel relatif baru tapi menu breakfast-nya kurang enak, lauknya selalu habis.",overall bagus iya hotel relatif baru menu breakfastnya kurang enak lauk selalu habis,"Overall, it's good, yes, the hotel is relatively new, the breakfast menu is not delicious, the side dishes are always out of stock"
Go,AP,9.4,2017-05-22,"Salah satu hotel pilihan di Jogja, dekat bandara.",salah satu hotel pilih jogja dekat bandara,one of the hotels chosen in Jogja near the airport
Go,Afifa H.,9.4,2021-09-04,"Kalo ke jogja pasti kesini lagi 🥰. Semuanya ramah & dibantu, lokasi mudah ditemukan. So far kamar oke banget, sesuai dengan gambar yang tertera. Thank you!",kalau jogja kesini  semua ramah bantu lokasi mudah temu so far kamar oke banget sesuai gambar tera thank you,"If you come here in Jogja, everyone is friendly and helpful, the location is easy to meet so far, the rooms are really good, just like the picture, thank you"
Go,LD,8.5,2019-07-01,"Sarapan parah habis, kamar oke.",sarap parah habis kamar oke,"Bad breakfast, the room is okay"
Go,ra,8.5,2017-04-17,Nyaman sih tapi kasurnya agak keras,nyaman sih kasur keras,the mattress is comfortable
Go,GN,9.7,2021-05-28,,,
Go,R,9.7,2018-09-03,"Senang dengan pelayanannya, tidak susah.",senang layan susah,happy to serve difficult
Go,ES,6.3,2018-09-24,Untuk pelayanan sangat ramah check-in cepat. Lalu untuk kebersihan hotel masih kurang karena ada bercak kotoran noda di selimut dan dari dalam kamar hotel masih terdengar suara-suara dari luar sangat mengganggu. Lalu dari breakfast menu makanannya kurang variatif tidak enak dan pelayannya tidak sigap terhadap makanan yang sudah habis tidak segera di-refill. Semoga pihak manajemen hotel bisa memperbaiki lagi kekurangan yang ada demi kenyamanan customer.,layan sangat ramah checkin cepat lalu bersih hotel kurang bercak kotor noda selimut kamar hotel dengar suarasuara luar sangat ganggu lalu breakfast menu makan kurang variatif enak layan sigap makan habis segera direfill moga pihak manajemen hotel baik kurang nyaman customer,"Very friendly service, fast checkin then clean, hotel with few dirty spots, stains on hotel room blankets, hearing outside noises was very disturbing, then breakfast, food menu not varied, delicious, fast service, food finished immediately refilled, I hope the hotel management is good, less comfortable for customers"
Go,AB,6.1,2024-04-12,"Kamar sangat tidak nyaman dan tidak bersih. Ada laba2, ada kutu di kasur (ada 5 kutu), ada cicak di kamar. Meja2 berdebu seperti tidak pernah di lap/dibersihkan. Pintu kamar mandi tidak bisa tertutup tanpa kunci (otomatis menggeser terbuka sendiri), keran wastafel hanya keluar air panas hingga mendidih (tidak bisa dipakai), keran shower rusak (ketika dinyalakan, langsung otomatis mati dengan sendirinya, jadi harus dipegangin setiap kali mandi agar tetap menyala). Pelayanan lama, minta ganti sprei karena ada kutu di kasur namun baru datang kurang lebih 30 menit.",kamar sangat nyaman bersih laba kutu kasur kutu cicak kamar meja debu pernah lapdibersihkan pintu kamar mandi tutup kunci otomatis geser buka sendiri keran wastafel keluar air panas hingga didih pakai keran shower rusak nyala langsung otomatis mati sendiri jadi dipegangin kali mandi tetap nyala layan lama minta ganti sprei kutu kasur baru datang kurang lebih menit,"the room is very comfortable, clean, bed bugs, lizard bugs, room, table dust, never wiped, bathroom door closes, lock automatically slides, opens itself, sink faucet comes out hot water until it boils, use broken shower faucet, turns on immediately, automatically turns off by itself, so when you hold it, the shower stays on, the service takes a long time, ask for a change of bed linen The bed bugs only arrived in about a minute"
Go,YA,6.4,2019-09-30,Makan paginya tidak terkoordinir dengan baik sehingga harus menunggu karena kehabisan makanan.,makan pagi terkoordinir baik tunggu habis makan,"breakfast is well coordinated, wait until after eating"
Go,AS,6.2,2022-06-11,"Tidak menyediakan setrika, ac kurang dingin, tv rusak, akses pintu sulit dibuka.",sedia setrika ac kurang dingin tv rusak akses pintu sulit buka,"have an iron ready, the AC is not cold enough, the TV is broken, the door access is difficult to open"
Go,ra,9.1,2017-11-03,"Kamar bersih dan nyaman, tapi tidak ada shampo waktu check in sempat bingung karena di lobby tidak ada petugasnya.",kamar bersih nyaman shampo waktu check in sempat bingung lobby tugas,"clean comfortable rooms, shampoo when checking in, I was confused about lobby duties"
Go,Stanley R. W.,6.0,2022-09-17,"Pengalaman check out sangat buruk, petugas sangat kasar kepada istri saya! Saya tidak tahu apa yang dikatakan sampai jauh dari hotel, karena dikatakan dalam bahasa Indonesia! (her say; Silahkan, segera pergi dari sini!). Sedangkan itu masih pagi sekitar jam 8 pagi.",alam check out sangat buruk tugas sangat kasar istri tahu apa kata jauh hotel kata bahasa indonesia her sayang silah segera pergi sini pagi jam pagi,"check out nature is very bad, very rude duty, wife knows what the word far hotel says in Indonesian, her dear, please come here immediately, morning, morning hours"
Go,JA,6.2,2019-10-22,"Sarung bantal belum terpasang saat masuk ke kamar. Pintu geser kamar mandi tidak dapat tertutup rapat dan dikunci. Tidak ada handuk lantai di kamar mandi. Antisipasi atas banyaknya tamu tidak dilakukan ketika sarapan, sehingga hidangan banyak yang sudah habis di pukul 6.15, Padahal sarapan dimulai pukul 6.00.",sarung bantal pasang masuk kamar pintu geser kamar mandi tutup rapat kunci handuk lantai kamar mandi antisipasi atas banyak tamu laku sarap hidang banyak habis pukul padahal sarap mulai pukul,"pillow cases, put them on to enter the room, sliding bathroom doors, close tightly, lock towels, bathroom floor, in anticipation of many guests selling breakfast, many dishes finish at 12.00 even though breakfast starts at 12:00 p.m."
Go,ar,9.7,2021-02-23,"Kamar dgn kaca besar favorit banget. Hotelnya bagus, kamarnya nyaman. Wifinya kenceng enak buat wfh. Air minum refill sendiri disediakan galon deket lift (ini mantap banget si krn byk hotel yg pelit banget kasih air minum). Prefer pilih kamar nomor genap krn pemandangan di kaca bagus.",kamar kaca besar favorit banget hotel bagus kamar nyaman wifinya kenceng enak buat wfh air minum refill sendiri sedia galon dekat lift mantap banget si banyak hotel pelit banget kasih air minum prefer pilih kamar nomor genap pandang kaca bagus,"big glass room, very favorite, nice hotel, comfortable room, fast wifi, good for wfh, own refill drinking water, gallons available near the lift, really great, many hotels are really stingy in providing drinking water, prefer to choose even numbered rooms, good view of the glass"
Go,FT,9.7,2017-11-16,Bangunan baru. Cukup untuk perjalanan bisnis. Di samping hotel ada makanan dan jajanan murah.,bangun baru cukup jalan bisnis samping hotel makan jajan murah,"New build, just running a business next to the hotel, eating cheap snacks"
Go,MS,5.4,2023-03-16,Very bad. Toilet bau pesing. Kamar sempit.,very buruk toilet bau pesing kamar sempit,"very bad toilet smells of urine, cramped room"
Go,s***y,9.0,2024-08-15,"Spre kasur kurang bersih, gelas untuk minum saat breakfest kurang bersih harus di lap tisu beberapa kali baru bersih, saat breakfest seharusnya kita minta tolor mata sapi tidak dikenakan harga lagi.",spre kasur kurang bersih gelas minum breakfest kurang bersih lap tisu beberapa kali baru bersih breakfest minta tolor mata sapi kena harga,"The bed sheets weren't clean, the breakfast drinking glasses weren't clean, wiped the tissue several times before it was clean, breakfest asked for a cow's eye toler, the price was hit"
Go,sd,9.1,2017-04-24,"Kamar hotel bersih, Karena hotel masih baru, sayang wifi nya lemot",kamar hotel bersih hotel baru sayang wifi nya lambat,"clean hotel rooms, new hotel, unfortunately the wifi is slow"
Go,DD,8.2,2017-10-21,"Minin tempat parkir, makananya tidak bervariasi",min tempat parkir makananya variasi,"Min, the parking lot has a variety of food"
Go,,8.5,2021-11-28,"Overall memuaskan, kamar bersih, ac nya dingin 😁 wifi juga oke, harga terjangkau banget, terima kasih ☺.",overall muas kamar bersih ac nya dingin wifi oke harga jangkau banget terima kasih ,"Overall satisfied, the room is clean, the AC is cold, the wifi is okay, the price is really affordable, thank you"
Go,wedha l.,9.4,2018-02-24,"Lumayan macet menuju ke lokasi, agak masuk gang but so far so good",lumayan macet tuju lokasi masuk gang but so far so bagus,quite congested to get to the alley entry location but so far so good
Go,ag,9.7,2019-01-31,"Kamarnya sangat amat nyaman, suasananya juga well banget. So dilihat dan saya rasakan sendiri memang pelayanannya top, berbeda dengan hotel lain yang selama ini saya kunjungi. Memuaskan deh.",kamar sangat nyaman suasana well banget so lihat rasa sendiri memang layan top beda hotel lama kunjung muas deh,"the rooms are very comfortable, the atmosphere is really good, so you can see for yourself that the service is top notch, unlike old hotels that are never satisfied"
Go,M***a,9.4,2024-04-28,"Affordable banget dari segi lokasi dan harga. Nyaman banget kamarnya. Tempatnya lumayan luas, tapi kesana waktu high season lebaran, jadi penuh banget. Tapi meski high season harganya sangat terjangkau. Saking ramenya parkirnya jadi antri, pihak hotel kasih pelayanan valet jadi ninggalin kunci mobil dan diatur sama petugas. Ramah semua, baik semua. Best banget hotel ini.",affordable banget segi lokasi harga nyaman banget kamar tempat lumayan luas kesana waktu high season lebaran jadi penuh banget meski high season harga sangat jangkau saking ramenya parkir jadi antri pihak hotel kasih layan valet jadi ninggalin kunci mobil atur sama tugas ramah semua baik semua best banget hotel,"Very affordable in terms of location, very comfortable prices, the rooms are quite spacious, there during the high season for Eid is very full, even though in high season the prices are very affordable, the parking lot is so crowded, the hotel queues provide valet service, so leave the car keys, arrange it with friendly staff, everything is good, everything is really the best hotel"
Go,SR,8.5,2022-05-28,,,
Go,Y,8.5,2017-07-11,Mantap hotelnya kalau k jogja lagi bisa buat recomended...,mantap hotel kalau jogja buat recomended,A great hotel if Jogja is recommended
Go,HM,5.1,2018-07-29,"Mengecewakan, kamar mandi kurang bersih. Menu sarapan terbatas dan kurang menggugah selera kebersihan area makanan juga kurang.",kecewa kamar mandi kurang bersih menu sarap batas kurang gugah selera bersih area makan kurang,"Disappointed, the bathroom is not clean, the breakfast menu is not very appetizing, the dining area is not clean enough"
Go,JA,5.9,2022-05-16,"Sudah sering punya experience nginep di hotel 3 daerah jogja but so far untuk hygiene ini paling parah. Kloset tidak dibersihkan sampai dalamnya kuning banget, karet kaca pembatas shower lumutan, shower berkerak coklat, sabun tidak diisi dan handuknya robek-robek plus bau apek. Semoga ke depannya bisa lebih baik.",sering punya experience inap hotel daerah jogja but so far hygiene paling parah kloset bersih dalam kuning banget karet kaca batas shower lumut shower kerak coklat sabun isi handuk robekrobek plus bau apek moga depan lebih baik,"I often have the experience of staying at hotels in the Jogja area but so far hygiene is the worst. The toilet is clean, very yellow, rubber, glass, shower limit, moss shower, brown crust, soap filled with torn towels, plus a musty smell. Hopefully the front will be better"
Go,yy,8.5,2017-08-28,Hotel nyaman bersih dan murah.,hotel nyaman bersih murah,cheap clean comfortable hotel
Go,Syaifurrohman,8.5,2018-10-22,"Kamar yang kami pesan sesuai dengan yang kami harapkan, pelayanan sangat memuaskan, makan pagi dan tempat enak hanya stok makanan perlu ditambah karena kebetulan pas kita mau ambil ada beberapa makanan yang sudah habis.",kamar pesan sesuai harap layan sangat muas makan pagi tempat enak stok makan perlu tambah betul pas mau ambil beberapa makan habis,"the room ordered was as expected, the service was very satisfying, the breakfast was delicious, the food stock needed to be improved when I wanted to take some food and it was finished"
Go,Alansyah A.,8.7,2021-08-22,"Dekorasi kamar bagus dan ada kaca lebar, tetapi tempat sampah cuman di kamar mandi lalu trouble wifi padahal lagi butuh dan 2 malam tetap trouble jadi sangat di sayangkan.",dekorasi kamar bagus kaca lebar tempat sampah cuma kamar mandi lalu masalah wifi padahal butuh malam tetap masalah jadi sangat sayang,"the room decoration is nice, the wide glass trash can is only the bathroom then the wifi problem even though it takes the night is still a problem so it's a shame"
Go,AF,8.3,2019-02-10,"Check-in terlambat dan butuh waktu cukup lama, tetapi segalanya baik-baik saja.",checkin lambat butuh waktu cukup lama segala baikbaik,"slow checkin takes quite a long time, everything is fine"
Go,R***l,6.4,2024-07-10,"Lokasi cukup oke, bisa early check in. Tp resepsionis hrsnya bisa lebih ramah, yang paling disayangkan dari room servcie mau pinjam alat makan harus ada transaksi dengan resto dulu, lalu dari housekeeping karena handuk kami basah semua dan kamar mandi drainase nya kurang bagus, kami harus pinjem towel tambahan. Dan itu pun kena charge per towel nya. ~> Ini hal yang sangat disayangkan dari hotel bintang 3.",lokasi cukup oke early check in resepsionis hrsnya lebih ramah paling sayang room servcie mau pinjam alat makan transaksi resto dulu lalu housekeeping handuk basah semua kamar mandi drainase nya kurang bagus pinjem towel tambah kena charge per towel nya sangat sayang hotel bintang,"the location is quite okay, early check in, the receptionist should be friendlier, most unfortunately room service, want to borrow cutlery, restaurant transactions first, then housekeeping, wet towels in all bathrooms, the drainage is not good, borrow towels, plus you get charged per towel, it's a shame, it's a star hotel."
Go,Mt,5.4,2018-09-02,"Ketika saya masuk kamar gelasnya kotor, tong sampahnya cuma ada 1 dikamar mandi saja, karena saya pesan smoking room di laci laci banyak abu rokok yang tidak dibersihkan, kasur terlalu keras tidak empuk, breakfastnya mengecewakan.",masuk kamar gelas kotor tong sampah cuma kamar mandi pesan smoking room laci laci banyak abu rokok bersih kasur terlalu keras empuk breakfastnya kecewa,"Entering the room, dirty glasses, trash can, only bathroom ordered smoking room, drawers, lots of cigarette ash, clean, mattress too hard, soft, breakfast was disappointing"
Go,C***l,8.7,2024-06-27,"Nyaman, tapi kamarnya lumayan jorok, kolong meja dan depannya banyak rambut², malah ada bekas pesta😩",nyaman kamar lumayan jorok kolong meja depan banyak rambut bahkan bekas pesta,"comfortable, quite dirty room under the front desk, lots of hair, even traces of party"
Go,AN,8.5,2018-11-26,"Tempat nyaman, cukup luas, bersih, kamar seperti di foto, cukup memuaskan hanya saja ada yang sedikit mengganggu kemarin saat saya menginap, Sabun mandi macet seperti habis, tapi setelah saya bilang ro boy langsung ditangani tempat parkir terlalu sempit, Jadi untuk tamu yang ingin parkir dekat hotel harus datang lebih awal tapi overall oke lah.",tempat nyaman cukup luas bersih kamar foto cukup muas sedikit ganggu kemarin inap sabun mandi macet habis bilang ro boy langsung tangan tempat parkir terlalu sempit jadi tamu parkir dekat hotel datang lebih awal overall oke lah,"comfortable place, quite spacious, clean, room, photos quite satisfactory, a little disturbed yesterday's stay, shower soap was stuck, said ro boy straight away, the parking lot was too narrow, so guests parking near the hotel arrived early. Overall, it was okay."
Go,Moh R. Y.,8.2,2017-12-22,"Saya booking dengan special request untuk non smookingroom, sampai checkin dan masuk kamar dikasih kamar smookingroom, saya konfirmasi via telepon kamar untuk minta ganti ke nonsmookingroom, tapi CS bilang sudah tidak ada room karena ada rombongan tadi pagi, saya tegas bilang saya udah jauh-jauh hari booking kamar dengan special request nonsmookingroom, btw akhirnya saya dapat kamar nya, item breakfast sangat sedikit dengan rate harga saat itu saya checkin.",pesan special request non smookingroom checkin masuk kamar kasih kamar smookingroom konfirmasi via telepon kamar minta ganti nonsmookingroom cs bilang room rombong tadi pagi tegas bilang jauhjauh hari pesan kamar special request nonsmookingroom ngomong-ngomong akhir kamar nya hitam breakfast sangat sedikit rate harga checkin,"order a special request non-smooking room checkin, enter the room, give a smooking room room, confirm via telephone, ask for a change of non-smooking room, CS said the room was broken this morning, firmly said, far in advance, order a special request non-smooking room room, by the way, the room ended up being black, breakfast was very low, the check-in price rate"
Go,AS,5.6,2017-10-16,Menu breakfast kurang bervariasi. Cuma telor sama mi doang,menu breakfast kurang variasi cuma telor sama mi,"The breakfast menu lacks variety, just eggs and noodles"
Go,YN,5.1,2019-04-23,Lokasi bagus tapi parkiran kurang dan kamar tidak sesuai dengan hotel berbintang sabun dan lain-lain diminta dulu baru tersedia. Untuk sarapan paginya dibawah standar dan beberapa makanan agak basi dan amis.,lokasi bagus parkir kurang kamar sesuai hotel bintang sabun lainlain minta dulu baru sedia sarap pagi bawah standar beberapa makan basi amis,"good location, parking, not enough rooms according to other soap star hotels, ask first and then prepare substandard breakfast, some food is stale and fishy"
Go,DS,6.1,2017-08-07,"Tempat lumayan nyaman tetapi breakfast jauh dari kebiasaan hotel tempat kami menginap sebelum-sebelumnya,makanan ala kadarnya menu sangat sedikit buah tidak segar..",tempat lumayan nyaman breakfast jauh biasa hotel tempat inap sebelumsebelumnyamakanan ala kadar menu sangat sedikit buah segar,"The place is quite comfortable, breakfast is far from the usual hotel where you stay before the previous food is at the level of the menu, there is very little fresh fruit"
Go,fa,6.0,2018-10-28,"Waktu mandi airnya tidak panas dan airnya kotor. Kadung sudah basah. Untuk sarapannya kurang sip, perlu peningkatan.",waktu mandi air panas air kotor kadung basah sarap kurang perlu tingkat,"When you take a hot shower, the dirty water is so wet that you don't need to level it"
Go,DA,6.0,2018-08-28,"AC rusak, dan hampir melukai karena keluar bunga es, sabun mandi habis tidak ada pengecekan, dan ada semut di kasur.",ac rusak hampir luka keluar bunga es sabun mandi habis kece semut kasur,"the air conditioner was broken and the shower soap almost froze out, the mattress ants ran out"
Go,MD,9.7,2023-01-07,"Staff ramah, kebersihan kamar oke, AC juga dingin, thank you 😁",staff ramah bersih kamar oke ac dingin thank you,"friendly staff, clean rooms, okay, cold AC, thank you"
Go,Dawatul F. S.,5.5,2019-09-29,"Check-in yang seharusnya jam 2, tetapi tidak bisa check-in dikarenakan ketersediaan kamar yang tidak ada. Jadi harus menunggu. Saya sudah titip KTP untuk kamar non smoking dan double bed, saya tinggal untuk mencari makan karena tidak bisa check-in. Ternyata saat saya check-in, diberikan kamar smoking room.",checkin jam checkin karena sedia kamar jadi tunggu titip ktp kamar non smoking double bed tinggal cari makan checkin nyata checkin beri kamar smoking room,checkin at checkin time because the room is available so wait and leave your ID card non smoking double bed room just looking for something to eat real checkin checkin give a smoking room
Go,AM,8.5,2021-03-24,Fasilitas sesuai dengan deskripsi,fasilitas sesuai deskripsi,facilities according to description
Go,BA,8.8,2018-11-19,"Mantap, tapi makanannya kurang variatif.",mantap makan kurang variatif,steady eating less varied
Go,VS,5.7,2018-07-19,"Lokasi hotel dekat bandara, selebihnya semua biasa saja.",lokasi hotel dekat bandara lebih semua biasa,The location of the hotel near the airport is more than ordinary
Go,BS,6.7,2017-05-08,Tidak ada yang spesial menginap di sana ..,spesial inap sana,special stay there
Go,Maryono,8.5,2018-09-06,"Cukup bagus dan meyenangkan, karyawannya ramah tamah.",cukup bagus meyenangkan karyawannya ramah tamah,"quite good, the employees are friendly and pleasant"
Go,LH,6.4,2020-01-02,"Sebenarnya cukup bagus untuk kamarnya. Tapi pelayanan breakfastnya parah sekali semuanya serba habis dan tidak di refill lagi. Terutama hari trakir berbarengan dengan tour anak sampai jabar, breakfast amburadul, kamar malamnya di ketok-ketok sama anak-anak norak. Harusnya lantainya dibedakan dong.",benar cukup bagus kamar layan breakfastnya parah sekali semua serba habis refill utama hari trakir bareng tour anak jabar breakfast amburadul kamar malam ketokketok sama anakanak norak harus lantai beda dong,"It's really quite good, the breakfast service is really bad, everything is completely out of refills, the main day is traveling with West Java children's tour, breakfast is in disarray, the room at night gets knocked over by the tacky kids, you have to have a different floor, bro"
Go,DD,9.4,2021-07-15,"Oke sih, saya menginap di lantai 8, tp wifinya tidak sampai di lantai atas.",oke sih inap lantai wifinya lantai atas,"okay, stay on the top floor of the wifi"
Go,sw,6.0,2020-01-26,Sebenarnya murah dan kamar besar. tapi AC tidak dingin. sangat disayangkan. Kecewa tapi tidak banyak tidak ada air minum botol di kamar. Harus ambil sendiri di galon yang tersedia.,benar murah kamar besar ac dingin sangat sayang kecewa banyak air minum botol kamar ambil sendiri galon sedia,"Really cheap, big rooms, cold AC, very unfortunately disappointed, lots of bottled water, take your own gallon in the room"
Go,Alip S.,4.8,2024-02-21,Hati-hati nginep di sini pas ditinggal ada pegawai yang masuk tanpa konfirmasi dulu.,hatihati inap sini pas tinggal pegawai masuk konfirmasi dulu,Be careful staying here when the staff just comes in to confirm first
Go,KA,6.1,2018-09-05,Kamar sangat kotor sehingga hari itu saya dipanggil kantor depan untuk membantu membersihkan kamar saya dan yang kedua adalah layanan kebersihan tidak mengganti sprei,kamar sangat kotor hari panggil kantor depan bantu bersih kamar dua layan bersih ganti sprei,"the room was very dirty. Call the front office to help clean the second room, clean service, change the bed sheets"
Go,FK,5.5,2017-08-20,Breakfastnya harus nunggu lama dan disiapkan seperti ala kadarnya. Tidak disiapkan dengan baik,breakfastnya tunggu lama siap ala kadar siap baik,"the breakfast is a long wait, it's ready to taste, it's good"
